{
  "schemaVersion": 1,
  "key": "recipe.custom-lumber",
  "id": 9100001,
  "names": {
    "en_us": "Custom Lumber"
  },
  "descriptions": {},
  "craftPackIds": [
    19
  ],
  "skillId": 9400001,
  "skillClone": {
    "sourceId": 14618,
    "id": 9400001,
    "laborCost": 15,
    "castingTime": 6000,
    "skillEffectRowIds": [
      9500001
    ]
  },
  "requiredDoodadId": 558,
  "actabilityCategoryId": 31,
  "actabilityLimit": 0,
  "castDelay": 6000,
  "worldInteractionId": 42,
  "recommendLevel": 0,
  "visibleOrder": 0,
  "needBind": false,
  "showUpperCrafts": true,
  "rowIds": {
    "localization": {
      "title": 9600002
    },
    "craftPackLinks": [
      9800001
    ]
  },
  "materials": [
    {
      "id": 9700003,
      "itemId": 8017,
      "amount": 9,
      "mainGrade": false,
      "requiredGrade": -1
    }
  ],
  "products": [
    {
      "id": 9750001,
      "itemId": 8337,
      "amount": 3,
      "rate": 100,
      "showLowerCrafts": true,
      "useGrade": false,
      "itemGradeId": 0
    }
  ]
}
