{
  "schemaVersion": 1,
  "key": "recipe.custom-lumber-2",
  "id": 9100002,
  "names": {
    "en_us": "Multi Output Test"
  },
  "descriptions": {},
  "craftPackIds": [
    14
  ],
  "skillId": 9400002,
  "skillClone": {
    "sourceId": 14618,
    "id": 9400002,
    "laborCost": 25,
    "castingTime": 6000,
    "skillEffectRowIds": [
      9500002
    ]
  },
  "requiredDoodadId": 566,
  "actabilityCategoryId": 48,
  "actabilityLimit": 0,
  "castDelay": 6000,
  "worldInteractionId": 42,
  "recommendLevel": 0,
  "visibleOrder": 0,
  "needBind": false,
  "showUpperCrafts": true,
  "rowIds": {
    "localization": {
      "title": 9600003
    },
    "craftPackLinks": [
      9800002
    ]
  },
  "materials": [
    {
      "id": 9700004,
      "itemId": 8017,
      "amount": 3,
      "mainGrade": false,
      "requiredGrade": -1
    }
  ],
  "products": [
    {
      "id": 9750002,
      "itemId": 16353,
      "amount": 1,
      "rate": 100,
      "showLowerCrafts": false,
      "useGrade": false,
      "itemGradeId": 0
    },
    {
      "id": 9750003,
      "itemId": 16354,
      "amount": 1,
      "rate": 100,
      "showLowerCrafts": false,
      "useGrade": false,
      "itemGradeId": 0
    },
    {
      "id": 9750004,
      "itemId": 16355,
      "amount": 1,
      "rate": 100,
      "showLowerCrafts": false,
      "useGrade": false,
      "itemGradeId": 0
    }
  ]
}
